workId,typ,cnt,name,node,parent,fromIndex,toIndex
faadfd23-8b46-4540-8802-4b8c1b199559,TITL,1,Liber Primus,ef052f65-2b8b-4aed-b015-6031b794fd43,7c5c98ef-9553-46a7-ac32-c67d72c4b3a1,1,2
faadfd23-8b46-4540-8802-4b8c1b199559,PROL,1,PROLOGUS,99720b49-e1e9-4c5e-9de8-e136fee61620,7c5c98ef-9553-46a7-ac32-c67d72c4b3a1,3,50
faadfd23-8b46-4540-8802-4b8c1b199559,TITL,1,PROLOGUS,01c652ff-3367-4b9e-922a-81931c5caabb,99720b49-e1e9-4c5e-9de8-e136fee61620,3,3
faadfd23-8b46-4540-8802-4b8c1b199559,VERS,1,"Aesopus auctor quam materiam repperit,",20634480-a739-4a74-ac23-3641278bc984,99720b49-e1e9-4c5e-9de8-e136fee61620,4,9
faadfd23-8b46-4540-8802-4b8c1b199559,VERS,2,Hanc ego polivi versibus senariis.,87ef698d-92a0-440c-9e9c-d02980424277,99720b49-e1e9-4c5e-9de8-e136fee61620,10,15
faadfd23-8b46-4540-8802-4b8c1b199559,VERS,3,Duplex libelli dos est: quod risum movet,95cae87b-d9cc-45ba-a7c3-e5bfd34afe62,99720b49-e1e9-4c5e-9de8-e136fee61620,16,23
faadfd23-8b46-4540-8802-4b8c1b199559,VERS,4,Et quod prudenti vitam consilio monet.,e9f39cce-ec1a-43a7-b55f-f62c08755237,99720b49-e1e9-4c5e-9de8-e136fee61620,24,30
faadfd23-8b46-4540-8802-4b8c1b199559,VERS,5,"Calumniari si quis autem voluerit,",879caa1e-df9b-4462-9b0a-0e737436c6b5,99720b49-e1e9-4c5e-9de8-e136fee61620,31,36
faadfd23-8b46-4540-8802-4b8c1b199559,VERS,6,"Quod arbores loquantur, non tantum ferae,",6ba31200-a63f-41af-a8aa-c8c1976e16a1,99720b49-e1e9-4c5e-9de8-e136fee61620,37,44
faadfd23-8b46-4540-8802-4b8c1b199559,VERS,7,Fictis iocari nos meminerit fabulis.,0493bef6-c3a4-4714-ab77-36e0a8a6d319,99720b49-e1e9-4c5e-9de8-e136fee61620,45,50
faadfd23-8b46-4540-8802-4b8c1b199559,POEM,1,Lupus et agnus.,b30c6368-649c-4fda-94a2-ca539a1e9217,7c5c98ef-9553-46a7-ac32-c67d72c4b3a1,51,170
faadfd23-8b46-4540-8802-4b8c1b199559,TITL,1,Lupus et agnus.,158ce2ce-ae94-40ed-be40-f6765b3d2f01,b30c6368-649c-4fda-94a2-ca539a1e9217,51,54
faadfd23-8b46-4540-8802-4b8c1b199559,VERS,1,Ad rivum eundem lupus et agnus venerant,2183500d-3ca7-4b88-adca-5068a64324aa,b30c6368-649c-4fda-94a2-ca539a1e9217,55,61
faadfd23-8b46-4540-8802-4b8c1b199559,VERS,2,Siti compulsi; superior stabat lupus,b92a8a89-9d25-4133-9390-55ce2ed4038d,b30c6368-649c-4fda-94a2-ca539a1e9217,62,67
faadfd23-8b46-4540-8802-4b8c1b199559,VERS,3,Longeque inferior agnus. Tunc fauce improba,8a0d3055-f669-4051-b229-c21049a62d2a,b30c6368-649c-4fda-94a2-ca539a1e9217,68,74
faadfd23-8b46-4540-8802-4b8c1b199559,VERS,4,Latro incitatus iurgii causam intulit.,12a3fcb0-1eca-46c4-938b-28579cf0b4d8,b30c6368-649c-4fda-94a2-ca539a1e9217,75,80
faadfd23-8b46-4540-8802-4b8c1b199559,VERS,5,"Cur, inquit, turbulentam fecisti mihi",b2665c2f-89aa-40df-ac24-f6766460ccbe,b30c6368-649c-4fda-94a2-ca539a1e9217,81,87
faadfd23-8b46-4540-8802-4b8c1b199559,VERS,6,Aquam bibenti? Laniger contra timens:,1496fb15-94ee-4f0c-a6c4-76cf44d6ff27,b30c6368-649c-4fda-94a2-ca539a1e9217,88,94
faadfd23-8b46-4540-8802-4b8c1b199559,VERS,7,"Qui possum, quaeso, facere, quod quereris, lupe?",580b0eaa-fb5a-4064-8cba-ecc7427832e5,b30c6368-649c-4fda-94a2-ca539a1e9217,95,106
faadfd23-8b46-4540-8802-4b8c1b199559,VERS,8,A te decurrit ad meos haustus liquor.,95e0cd5c-1e87-435c-9ad0-995acef9391f,b30c6368-649c-4fda-94a2-ca539a1e9217,107,114
faadfd23-8b46-4540-8802-4b8c1b199559,VERS,9,Repulsus ille veritatis viribus:,8b117a07-8d66-48e4-950e-80054f63da68,b30c6368-649c-4fda-94a2-ca539a1e9217,115,119
faadfd23-8b46-4540-8802-4b8c1b199559,VERS,10,"Ante hos sex menses male, ait, dixisti mihi.",454370f7-5bbb-4cc5-adfd-4fba01869d72,b30c6368-649c-4fda-94a2-ca539a1e9217,120,130
faadfd23-8b46-4540-8802-4b8c1b199559,VERS,11,Respondit agnus: Equidem natus non eram.,1a18b581-5da0-49bb-8e6c-0d6facbfdde9,b30c6368-649c-4fda-94a2-ca539a1e9217,131,138
faadfd23-8b46-4540-8802-4b8c1b199559,VERS,12,"Pater hercle tuus, ille inquit, male dixit mihi.",b3b91b96-6726-4cf7-a454-acb7453759ff,b30c6368-649c-4fda-94a2-ca539a1e9217,139,149
faadfd23-8b46-4540-8802-4b8c1b199559,VERS,13,Atque ita correptum lacerat iniusta nece.,3920266b-e7c9-4270-ba76-d3a995fa87e9,b30c6368-649c-4fda-94a2-ca539a1e9217,150,156
faadfd23-8b46-4540-8802-4b8c1b199559,VERS,14,"Haec propter illos scripta est homines fabula,",8898d7df-25e9-4015-b24e-ff5ed8319663,b30c6368-649c-4fda-94a2-ca539a1e9217,157,164
faadfd23-8b46-4540-8802-4b8c1b199559,VERS,15,Qui fictis causis innocentes opprimunt.,39edbfc2-f5b2-4584-b850-073e27a7c825,b30c6368-649c-4fda-94a2-ca539a1e9217,165,170
faadfd23-8b46-4540-8802-4b8c1b199559,POEM,2,Ranae regem petierunt.,73ec9020-329c-4ddc-acbe-1c6c3f5af1d1,7c5c98ef-9553-46a7-ac32-c67d72c4b3a1,171,379
faadfd23-8b46-4540-8802-4b8c1b199559,TITL,1,Ranae regem petierunt.,a3b14b7b-5f86-46f9-bcac-8b00336c5f14,73ec9020-329c-4ddc-acbe-1c6c3f5af1d1,171,174
faadfd23-8b46-4540-8802-4b8c1b199559,VERS,1,"Athenae cum florerent aequis legibus,",8c405bf3-d977-43d6-9fa3-8acc56bdf1cb,73ec9020-329c-4ddc-acbe-1c6c3f5af1d1,175,180
faadfd23-8b46-4540-8802-4b8c1b199559,VERS,2,Procax libertas civitatem miscuit,3424c24c-b31d-4b67-a9f4-a7ac1959bb67,73ec9020-329c-4ddc-acbe-1c6c3f5af1d1,181,184
faadfd23-8b46-4540-8802-4b8c1b199559,VERS,3,Frenumque solvit pristinum licentia.,554a3a6a-6bc2-4a5d-8377-545324d262ef,73ec9020-329c-4ddc-acbe-1c6c3f5af1d1,185,189
faadfd23-8b46-4540-8802-4b8c1b199559,VERS,4,Hic conspiratis factionum partibus,3321c420-7925-41a5-9e5e-70e88a763c14,73ec9020-329c-4ddc-acbe-1c6c3f5af1d1,190,193
faadfd23-8b46-4540-8802-4b8c1b199559,VERS,5,Arcem tyrannus occupat Pisistratus.,bccf8a4b-4083-47c7-bc68-bec31ab62bc9,73ec9020-329c-4ddc-acbe-1c6c3f5af1d1,194,198
faadfd23-8b46-4540-8802-4b8c1b199559,VERS,6,"Cum tristem servitutem flerent Attici,",bf0c520e-8ab9-4247-9aab-498aad84c1a7,73ec9020-329c-4ddc-acbe-1c6c3f5af1d1,199,204
faadfd23-8b46-4540-8802-4b8c1b199559,VERS,7,"(Non quia crudelis ille, sed quoniam gravis",fa204c2b-83b8-4b4c-8796-d389430a7313,73ec9020-329c-4ddc-acbe-1c6c3f5af1d1,205,213
faadfd23-8b46-4540-8802-4b8c1b199559,VERS,8,"Omnino insuetis), onus et coepissent queri,",8c5cbb5a-505c-4660-ad85-497c4bb512dd,73ec9020-329c-4ddc-acbe-1c6c3f5af1d1,214,222
faadfd23-8b46-4540-8802-4b8c1b199559,VERS,9,Aesopus talem tum fabellam rettulit.,87cda241-6d6d-4671-816a-76aea351ddb5,73ec9020-329c-4ddc-acbe-1c6c3f5af1d1,223,228
faadfd23-8b46-4540-8802-4b8c1b199559,VERS,10,Ranae vagantes liberis paludibus,e8d27ce7-a6d9-4906-a618-4bc928e8f025,73ec9020-329c-4ddc-acbe-1c6c3f5af1d1,229,232
faadfd23-8b46-4540-8802-4b8c1b199559,VERS,11,"Clamore magno regem petiere a Iove,",fe6b273e-0b93-4e92-b611-3ffffe4480ab,73ec9020-329c-4ddc-acbe-1c6c3f5af1d1,233,239
faadfd23-8b46-4540-8802-4b8c1b199559,VERS,12,Qui dissolutos mores vi compesceret.,28cf527f-726b-4975-aaf6-6ade9a4ab3f2,73ec9020-329c-4ddc-acbe-1c6c3f5af1d1,240,245
faadfd23-8b46-4540-8802-4b8c1b199559,VERS,13,Pater deorum risit atque illis dedit,a1ed2c75-c396-4c71-a0dd-80e75c7f2f17,73ec9020-329c-4ddc-acbe-1c6c3f5af1d1,246,251
faadfd23-8b46-4540-8802-4b8c1b199559,VERS,14,"Parvum tigillum, missum quod subito vadi",c4eb2a2b-3f49-431b-8da2-cf78cd839e10,73ec9020-329c-4ddc-acbe-1c6c3f5af1d1,252,258
faadfd23-8b46-4540-8802-4b8c1b199559,VERS,15,Motu sonoque terruit pavidum genus.,d43b1ae8-6617-4b43-9673-a72bafd9f5fd,73ec9020-329c-4ddc-acbe-1c6c3f5af1d1,259,264
faadfd23-8b46-4540-8802-4b8c1b199559,VERS,16,"Hoc mersum limo cum iaceret diutius,",2a7d3664-5bf9-43b5-944d-4e73d62aa51e,73ec9020-329c-4ddc-acbe-1c6c3f5af1d1,265,271
faadfd23-8b46-4540-8802-4b8c1b199559,VERS,17,Forte una tacite profert e stagno caput,f9e9f09d-3cb3-454a-848f-c4d7a1ff2783,73ec9020-329c-4ddc-acbe-1c6c3f5af1d1,272,278
faadfd23-8b46-4540-8802-4b8c1b199559,VERS,18,Et explorato rege cunctas evocat.,990152b0-4ece-4657-b611-67b418329830,73ec9020-329c-4ddc-acbe-1c6c3f5af1d1,279,284
faadfd23-8b46-4540-8802-4b8c1b199559,VERS,19,Illae timore posito certatim adnatant,debf7fb0-e5d3-4241-b2a2-7b87e5855585,73ec9020-329c-4ddc-acbe-1c6c3f5af1d1,285,289
faadfd23-8b46-4540-8802-4b8c1b199559,VERS,20,Lignumque supera turba petulans insilit.,20ebc576-1ce0-49a3-835d-78aa15e8880a,73ec9020-329c-4ddc-acbe-1c6c3f5af1d1,290,295
faadfd23-8b46-4540-8802-4b8c1b199559,VERS,21,"Quod cum inquinassent omni contumelia,",1aec7223-c39f-4e23-b501-ce9b0f034203,73ec9020-329c-4ddc-acbe-1c6c3f5af1d1,296,301
faadfd23-8b46-4540-8802-4b8c1b199559,VERS,22,"Alium rogantes regem misere ad Iovem,",1624c839-def2-4c43-912a-d20868c8216b,73ec9020-329c-4ddc-acbe-1c6c3f5af1d1,302,308
faadfd23-8b46-4540-8802-4b8c1b199559,VERS,23,Inutilis quoniam esset qui fuerat datus.,1d78e0a9-0505-4d04-a08c-81b333a42ccc,73ec9020-329c-4ddc-acbe-1c6c3f5af1d1,309,315
faadfd23-8b46-4540-8802-4b8c1b199559,VERS,24,"Tum misit illis hydrum, qui dente aspero",10d82bc5-2a2e-4a04-a5a3-55780e35e659,73ec9020-329c-4ddc-acbe-1c6c3f5af1d1,316,323
faadfd23-8b46-4540-8802-4b8c1b199559,VERS,25,Corripere coepit singulas. Frustra necem,f570f277-02a4-432a-865d-e8e843be8c5e,73ec9020-329c-4ddc-acbe-1c6c3f5af1d1,324,329
faadfd23-8b46-4540-8802-4b8c1b199559,VERS,26,"Fugitant inertes, vocem praecludit metus.",32812ffc-4996-4efc-ba41-0b910bc3bf8a,73ec9020-329c-4ddc-acbe-1c6c3f5af1d1,330,336
faadfd23-8b46-4540-8802-4b8c1b199559,VERS,27,"Furtim igitur dant Mercurio mandata ad Iovem,",b5f59cdd-f202-4b58-8b16-73db400ae317,73ec9020-329c-4ddc-acbe-1c6c3f5af1d1,337,344
faadfd23-8b46-4540-8802-4b8c1b199559,VERS,28,Afflictis ut succurrat. Tunc contra deus:,da26488a-e735-4b08-ba07-b878e6725391,73ec9020-329c-4ddc-acbe-1c6c3f5af1d1,345,352
faadfd23-8b46-4540-8802-4b8c1b199559,VERS,29,"Quia noluistis vestrum ferre inquit bonum,",a5017b1c-6750-454c-bb13-fc8307933a86,73ec9020-329c-4ddc-acbe-1c6c3f5af1d1,353,359
faadfd23-8b46-4540-8802-4b8c1b199559,VERS,30,"Malum perferte. — Vos quoque, o cives, ait,",608ff183-1e40-4a0d-8f21-9407fdde0a35,73ec9020-329c-4ddc-acbe-1c6c3f5af1d1,360,371
faadfd23-8b46-4540-8802-4b8c1b199559,VERS,31,"Hoc sustinete, maius ne veniat malum.",11d6cfe1-d92a-400a-b11c-bcd526e9bc29,73ec9020-329c-4ddc-acbe-1c6c3f5af1d1,372,379
faadfd23-8b46-4540-8802-4b8c1b199559,POEM,3,Graculus superbus et pavo.,d54951e2-83e4-452e-aea2-3c82e9f797ee,7c5c98ef-9553-46a7-ac32-c67d72c4b3a1,380,481
faadfd23-8b46-4540-8802-4b8c1b199559,TITL,1,Graculus superbus et pavo.,267172d3-870c-4e79-ba11-9bb55160bab7,d54951e2-83e4-452e-aea2-3c82e9f797ee,380,384
faadfd23-8b46-4540-8802-4b8c1b199559,VERS,1,Ne gloriari libeat alienis bonis,d24fa199-64f9-4f9e-a95b-688406e87e05,d54951e2-83e4-452e-aea2-3c82e9f797ee,385,389
faadfd23-8b46-4540-8802-4b8c1b199559,VERS,2,"Suoque potius habitu vitam degere,",6e4e82a6-04bd-444e-9bc8-078eb335297c,d54951e2-83e4-452e-aea2-3c82e9f797ee,390,395
faadfd23-8b46-4540-8802-4b8c1b199559,VERS,3,Aesopus nobis hoc exemplum prodidit.,258d1e98-1391-4315-b273-58236831eadb,d54951e2-83e4-452e-aea2-3c82e9f797ee,396,401
faadfd23-8b46-4540-8802-4b8c1b199559,VERS,4,"Tumens inani graculus superbia,",036741ea-d85e-4348-9c1e-3a40c08e9ade,d54951e2-83e4-452e-aea2-3c82e9f797ee,402,406
faadfd23-8b46-4540-8802-4b8c1b199559,VERS,5,Pennas pavoni quae deciderant sustulit,ed9df7d8-bd64-405d-b34f-0fd3be0bd26e,d54951e2-83e4-452e-aea2-3c82e9f797ee,407,411
faadfd23-8b46-4540-8802-4b8c1b199559,VERS,6,Seque exornavit. Deinde contemnens suos,d3f9792b-c23b-4851-b1af-df40f5ef66fe,d54951e2-83e4-452e-aea2-3c82e9f797ee,412,417
faadfd23-8b46-4540-8802-4b8c1b199559,VERS,7,Se inmiscuit pavonum formoso gregi.,7f96092f-60d4-42ac-8944-ca0f33beb5ca,d54951e2-83e4-452e-aea2-3c82e9f797ee,418,423
faadfd23-8b46-4540-8802-4b8c1b199559,VERS,8,Illi inpudenti pennas eripiunt avi,6c3a0229-16f2-4df9-800d-e3a7c3798351,d54951e2-83e4-452e-aea2-3c82e9f797ee,424,428
faadfd23-8b46-4540-8802-4b8c1b199559,VERS,9,Fugantque rostris. Male mulcatus graculus,4a99918e-b2d9-449f-a9ba-82dff443ccd6,d54951e2-83e4-452e-aea2-3c82e9f797ee,429,434
faadfd23-8b46-4540-8802-4b8c1b199559,VERS,10,Redire maerens coepit ad proprium genus;,477cef4a-5b4b-4072-b9ae-defac1715f34,d54951e2-83e4-452e-aea2-3c82e9f797ee,435,441
faadfd23-8b46-4540-8802-4b8c1b199559,VERS,11,A quo repulsus tristem sustinuit notam.,da49c511-9e32-462d-ab1f-aa40c093b4e9,d54951e2-83e4-452e-aea2-3c82e9f797ee,442,448
faadfd23-8b46-4540-8802-4b8c1b199559,VERS,12,"Tum quidam ex illis, quos prius despexerat:",e6cb0de8-74a8-40ea-99e6-5941c5700f23,d54951e2-83e4-452e-aea2-3c82e9f797ee,449,457
faadfd23-8b46-4540-8802-4b8c1b199559,VERS,13,Contentus nostris si fuisses sedibus,4e95e69b-6f4b-43fe-9237-d8e3fa31440c,d54951e2-83e4-452e-aea2-3c82e9f797ee,458,462
faadfd23-8b46-4540-8802-4b8c1b199559,VERS,14,"Et quod natura dederat voluisses pati,",d0e0265a-8540-49a6-8e44-b726560861b2,d54951e2-83e4-452e-aea2-3c82e9f797ee,463,469
faadfd23-8b46-4540-8802-4b8c1b199559,VERS,15,Nec illam expertus esses contumeliam,9a8ca100-9425-406b-a374-7522c84fffa5,d54951e2-83e4-452e-aea2-3c82e9f797ee,470,474
faadfd23-8b46-4540-8802-4b8c1b199559,VERS,16,Nec hanc repulsam tua sentiret calamitas.,1a2d4972-c3a5-43e9-a472-c5cee02bc4db,d54951e2-83e4-452e-aea2-3c82e9f797ee,475,481
faadfd23-8b46-4540-8802-4b8c1b199559,POEM,4,Canis per fluvium carnem ferens.,b1703415-b30d-4688-8545-0e4425c3f6d3,7c5c98ef-9553-46a7-ac32-c67d72c4b3a1,482,535
faadfd23-8b46-4540-8802-4b8c1b199559,TITL,1,Canis per fluvium carnem ferens.,eb3d1f66-2ce4-472b-8d8e-4dd410779272,b1703415-b30d-4688-8545-0e4425c3f6d3,482,487
faadfd23-8b46-4540-8802-4b8c1b199559,VERS,1,Amittit merito proprium qui alienum adpetit.,3eab5e1a-d13c-4e30-97a3-11511de410b9,b1703415-b30d-4688-8545-0e4425c3f6d3,488,494
faadfd23-8b46-4540-8802-4b8c1b199559,VERS,2,"Canis per flumen carnem cum ferret natans,",f09efcd8-32c0-4628-a681-f552650f01cc,b1703415-b30d-4688-8545-0e4425c3f6d3,495,502
faadfd23-8b46-4540-8802-4b8c1b199559,VERS,3,"Lympharum in speculo vidit simulacrum suum,",4fa8e293-0fa3-4fe7-95ed-00105256a3f4,b1703415-b30d-4688-8545-0e4425c3f6d3,503,509
faadfd23-8b46-4540-8802-4b8c1b199559,VERS,4,Aliamque praedam ab altero ferri putans,953d1963-b1c0-4cb9-be25-dfccd57af602,b1703415-b30d-4688-8545-0e4425c3f6d3,510,515
faadfd23-8b46-4540-8802-4b8c1b199559,VERS,5,Eripere voluit; verum decepta aviditas,2f5e3920-e0df-44a5-9bfe-cd3360ac9b5c,b1703415-b30d-4688-8545-0e4425c3f6d3,516,521
faadfd23-8b46-4540-8802-4b8c1b199559,VERS,6,"Et quem tenebat ore dimisit cibum,",441e64c5-2a2d-405f-a126-8140f1777787,b1703415-b30d-4688-8545-0e4425c3f6d3,522,528
faadfd23-8b46-4540-8802-4b8c1b199559,VERS,7,Nec quem petebat potuit adeo adtingere.,be548fee-74da-4c5f-959b-53b0a5cc2a46,b1703415-b30d-4688-8545-0e4425c3f6d3,529,535
faadfd23-8b46-4540-8802-4b8c1b199559,POEM,5,"Vacca, capella, ovis, et leo.",8c00e3c1-d1f6-4c22-81d4-14a52645075c,7c5c98ef-9553-46a7-ac32-c67d72c4b3a1,536,629
faadfd23-8b46-4540-8802-4b8c1b199559,TITL,1,"Vacca, capella, ovis, et leo.",45792f69-0de8-4d15-b440-e88358b5a27b,8c00e3c1-d1f6-4c22-81d4-14a52645075c,536,544
faadfd23-8b46-4540-8802-4b8c1b199559,VERS,1,Numquam est fidelis cum potente societas:,4a94d5d6-fa2a-4bad-956d-3330abe0c38b,8c00e3c1-d1f6-4c22-81d4-14a52645075c,545,551
faadfd23-8b46-4540-8802-4b8c1b199559,VERS,2,Testatur haec fabella propositum meum.,3fd48c3d-6ee0-4765-91b3-436a2b4b706b,8c00e3c1-d1f6-4c22-81d4-14a52645075c,552,557
faadfd23-8b46-4540-8802-4b8c1b199559,VERS,3,Vacca et capella et patiens ovis iniuriae,36a51704-2008-4d2a-a7a9-5601a80f1ee8,8c00e3c1-d1f6-4c22-81d4-14a52645075c,558,564
faadfd23-8b46-4540-8802-4b8c1b199559,VERS,4,Socii fuere cum leone in saltibus.,c56a160e-d051-48f6-9df2-c367004d55e9,8c00e3c1-d1f6-4c22-81d4-14a52645075c,565,571
faadfd23-8b46-4540-8802-4b8c1b199559,VERS,5,"Hi cum cepissent cervum vasti corporis,",55102e34-7a61-42cf-93f5-90cade4759e9,8c00e3c1-d1f6-4c22-81d4-14a52645075c,572,578
faadfd23-8b46-4540-8802-4b8c1b199559,VERS,6,"Sic est locutus, partibus factis, leo:",bbd427ba-93c4-491b-ad88-7a5e08a0ece9,8c00e3c1-d1f6-4c22-81d4-14a52645075c,579,587
faadfd23-8b46-4540-8802-4b8c1b199559,VERS,7,"Ego primam tollo, †nominor quia leo;",0d6798d5-18ec-4c6d-8f84-c8ceb414a74f,8c00e3c1-d1f6-4c22-81d4-14a52645075c,588,596
faadfd23-8b46-4540-8802-4b8c1b199559,VERS,8,"Secundam, quia sum fortis, tribuetis mihi;",0d09dabe-3e40-4138-8d92-b563486b93e5,8c00e3c1-d1f6-4c22-81d4-14a52645075c,597,605
faadfd23-8b46-4540-8802-4b8c1b199559,VERS,9,"Tum, quia plus valeo, me sequetur tertia;",8596b148-82d0-4555-aa9f-7d2d3185f313,8c00e3c1-d1f6-4c22-81d4-14a52645075c,606,615
faadfd23-8b46-4540-8802-4b8c1b199559,VERS,10,Malo afficietur si quis quartam tetigerit.,ee04439d-0956-47b5-bf9c-f49b04569582,8c00e3c1-d1f6-4c22-81d4-14a52645075c,616,622
faadfd23-8b46-4540-8802-4b8c1b199559,VERS,11,Sic totam praedam sola improbitas abstulit.,cb9da355-1a46-4a04-8d05-8fb34258baa6,8c00e3c1-d1f6-4c22-81d4-14a52645075c,623,629
faadfd23-8b46-4540-8802-4b8c1b199559,POEM,6,Ranae ad solem.,f79c1d94-c2ac-45a5-9131-548941ab700d,7c5c98ef-9553-46a7-ac32-c67d72c4b3a1,630,689
faadfd23-8b46-4540-8802-4b8c1b199559,TITL,1,Ranae ad solem.,dd94ce45-33eb-49e5-9dce-1784a2d1e9b1,f79c1d94-c2ac-45a5-9131-548941ab700d,630,633
faadfd23-8b46-4540-8802-4b8c1b199559,VERS,1,Vicini furis celebres vidit nuptias,aa81498f-cd44-46ff-9740-642eaaa5e006,f79c1d94-c2ac-45a5-9131-548941ab700d,634,638
faadfd23-8b46-4540-8802-4b8c1b199559,VERS,2,Aesopus et continuo narrare incipit:,fd07ab63-245a-4c0d-8f35-3c032fc3e3eb,f79c1d94-c2ac-45a5-9131-548941ab700d,639,644
faadfd23-8b46-4540-8802-4b8c1b199559,VERS,3,"Uxorem quondam Sol cum vellet ducere,",cca974e2-dad4-474c-bf3f-7c2ce4717874,f79c1d94-c2ac-45a5-9131-548941ab700d,645,651
faadfd23-8b46-4540-8802-4b8c1b199559,VERS,4,Clamorem ranae sustulere ad sidera.,eede2498-538e-4301-85d2-9c996288635c,f79c1d94-c2ac-45a5-9131-548941ab700d,652,657
faadfd23-8b46-4540-8802-4b8c1b199559,VERS,5,Convicio permotus quaerit Iuppiter,e2a01024-7369-4a3c-83a2-fb9299adca12,f79c1d94-c2ac-45a5-9131-548941ab700d,658,661
faadfd23-8b46-4540-8802-4b8c1b199559,VERS,6,Causam querelae. Quaedam tum stagni incola:,eb863895-c50e-4907-9e0d-287abb2e11ee,f79c1d94-c2ac-45a5-9131-548941ab700d,662,669
faadfd23-8b46-4540-8802-4b8c1b199559,VERS,7,Nunc inquit omnes unus exurit lacus,2c654a82-7464-44c8-82ae-c1c11bd77e7d,f79c1d94-c2ac-45a5-9131-548941ab700d,670,675
faadfd23-8b46-4540-8802-4b8c1b199559,VERS,8,Cogitque miseras arida sede emori.,d7279d8f-0f40-4ef0-827c-6e272f2c4dd6,f79c1d94-c2ac-45a5-9131-548941ab700d,676,681
faadfd23-8b46-4540-8802-4b8c1b199559,VERS,9,"Quidnam futurum est, si crearit liberos?",7473faea-cfb7-4f01-bff7-fa0b3acf74e7,f79c1d94-c2ac-45a5-9131-548941ab700d,682,689
faadfd23-8b46-4540-8802-4b8c1b199559,POEM,7,Vulpis ad personam tragicam.,104e52bf-bd69-4d76-8d92-d803868f2959,7c5c98ef-9553-46a7-ac32-c67d72c4b3a1,690,726
faadfd23-8b46-4540-8802-4b8c1b199559,TITL,1,Vulpis ad personam tragicam.,619723e7-7db4-4501-b4ac-d6f135d03ee3,104e52bf-bd69-4d76-8d92-d803868f2959,690,694
faadfd23-8b46-4540-8802-4b8c1b199559,VERS,1,Personam tragicam forte vulpes viderat:,ee09d02f-9389-4070-9839-6caa51cc270a,104e52bf-bd69-4d76-8d92-d803868f2959,695,700
faadfd23-8b46-4540-8802-4b8c1b199559,VERS,2,"O quanta species, inquit, cerebrum non habet!",6d5724c0-c35d-45b3-af5c-c506a8fb7c19,104e52bf-bd69-4d76-8d92-d803868f2959,701,710
faadfd23-8b46-4540-8802-4b8c1b199559,VERS,3,"Hoc illis dictum est, quibus honorem et gloriam",207d702d-b6ec-4753-b435-1fd10c07ad73,104e52bf-bd69-4d76-8d92-d803868f2959,711,719
faadfd23-8b46-4540-8802-4b8c1b199559,VERS,4,"Fortuna tribuit, sensum communem abstulit.",afb9fee7-c981-45f5-b996-84c6f87256e6,104e52bf-bd69-4d76-8d92-d803868f2959,720,726
faadfd23-8b46-4540-8802-4b8c1b199559,POEM,8,Lupus et gruis.,359f9532-7e61-45c5-b26d-223d495bb087,7c5c98ef-9553-46a7-ac32-c67d72c4b3a1,727,810
faadfd23-8b46-4540-8802-4b8c1b199559,TITL,1,Lupus et gruis.,2a93aad8-e909-4526-8ac5-82de3206d097,359f9532-7e61-45c5-b26d-223d495bb087,727,730
faadfd23-8b46-4540-8802-4b8c1b199559,VERS,1,"Qui pretium meriti ab improbis desiderat,",9d151115-0423-424e-91fb-ea13e101512c,359f9532-7e61-45c5-b26d-223d495bb087,731,737
faadfd23-8b46-4540-8802-4b8c1b199559,VERS,2,Bis peccat: primum quoniam indignos adiuvat;,4f56786a-8680-499f-87c7-1414a7834739,359f9532-7e61-45c5-b26d-223d495bb087,738,745
faadfd23-8b46-4540-8802-4b8c1b199559,VERS,3,Impune abire deinde quia iam non potest.,a01b82b7-ac25-4a15-b08a-dad23fd8646b,359f9532-7e61-45c5-b26d-223d495bb087,746,753
faadfd23-8b46-4540-8802-4b8c1b199559,VERS,4,"Os devoratum fauce cum haereret lupi,",064738f4-655e-4d8a-947a-141fa3f7a1a5,359f9532-7e61-45c5-b26d-223d495bb087,754,760
faadfd23-8b46-4540-8802-4b8c1b199559,VERS,5,Magno dolore victus coepit singulos,2f22122a-d793-4f40-ac52-182232917a1d,359f9532-7e61-45c5-b26d-223d495bb087,761,765
faadfd23-8b46-4540-8802-4b8c1b199559,VERS,6,"Illicere pretio, ut illud extraherent malum.",3d3d006a-2b47-42a0-af82-8c3765f002bd,359f9532-7e61-45c5-b26d-223d495bb087,766,773
faadfd23-8b46-4540-8802-4b8c1b199559,VERS,7,"Tandem persuasa est iure iurando gruis,",148452f8-1f9f-4ee1-824a-d32ad501a9fe,359f9532-7e61-45c5-b26d-223d495bb087,774,780
faadfd23-8b46-4540-8802-4b8c1b199559,VERS,8,"Gulaeque credens colli longitudinem,",d4784010-30fe-4e99-8d5b-3d47d6c40a6d,359f9532-7e61-45c5-b26d-223d495bb087,781,785
faadfd23-8b46-4540-8802-4b8c1b199559,VERS,9,Periculosam fecit medicinam lupo.,69d31b5e-6f67-461b-8909-36dbdb054e9e,359f9532-7e61-45c5-b26d-223d495bb087,786,790
faadfd23-8b46-4540-8802-4b8c1b199559,VERS,10,Pro quo cum pactum flagitaret praemium:,b7662bf4-dd29-480f-afd6-732adc0547dc,359f9532-7e61-45c5-b26d-223d495bb087,791,797
faadfd23-8b46-4540-8802-4b8c1b199559,VERS,11,Ingrata es inquit ore quae nostro caput,6534e8cf-3849-48e0-a066-7e479e377bfc,359f9532-7e61-45c5-b26d-223d495bb087,798,804
faadfd23-8b46-4540-8802-4b8c1b199559,VERS,12,Incolume abstuleris et mercedem postules.,e388e323-8c8a-4951-ac64-8a3ec5090294,359f9532-7e61-45c5-b26d-223d495bb087,805,810
faadfd23-8b46-4540-8802-4b8c1b199559,POEM,9,Passer ad leporem consiliator.,63cda0c5-ccbd-4c9f-985a-2eeaad27064d,7c5c98ef-9553-46a7-ac32-c67d72c4b3a1,811,883
faadfd23-8b46-4540-8802-4b8c1b199559,TITL,1,Passer ad leporem consiliator.,dfeb4ac4-4062-44a0-ad4f-4baba148ea30,63cda0c5-ccbd-4c9f-985a-2eeaad27064d,811,815
faadfd23-8b46-4540-8802-4b8c1b199559,VERS,1,Sibi non cavere et aliis consilium dare,da96caa4-abff-45d6-84e4-17753aa00b48,63cda0c5-ccbd-4c9f-985a-2eeaad27064d,816,822
faadfd23-8b46-4540-8802-4b8c1b199559,VERS,2,Stultum esse paucis ostendemus versibus.,225645ce-3fea-4a4f-bfe4-f4e406956af6,63cda0c5-ccbd-4c9f-985a-2eeaad27064d,823,828
faadfd23-8b46-4540-8802-4b8c1b199559,VERS,3,"Oppressum ab aquila, fletus edentem graves,",719c86f9-e1f7-434d-ab52-5e55dd0d4b45,63cda0c5-ccbd-4c9f-985a-2eeaad27064d,829,836
faadfd23-8b46-4540-8802-4b8c1b199559,VERS,4,Leporem obiurgabat passer: Ubi pernicitas,3b4056df-bbc4-4e0a-9f91-757b8c746934,63cda0c5-ccbd-4c9f-985a-2eeaad27064d,837,842
faadfd23-8b46-4540-8802-4b8c1b199559,VERS,5,Nota inquit illa est? Quid ita cessarunt pedes?,d5ba864e-fcdf-4b83-a2af-994e9bf12784,63cda0c5-ccbd-4c9f-985a-2eeaad27064d,843,852
faadfd23-8b46-4540-8802-4b8c1b199559,VERS,6,"Dum loquitur, ipsum accipiter necopinum rapit",557d7ea0-ac02-4c33-94aa-11ff3d8dca39,63cda0c5-ccbd-4c9f-985a-2eeaad27064d,853,859
faadfd23-8b46-4540-8802-4b8c1b199559,VERS,7,Questuque vano clamitantem interficit.,6655cc7c-2d10-45da-942f-2b9ff6649917,63cda0c5-ccbd-4c9f-985a-2eeaad27064d,860,864
faadfd23-8b46-4540-8802-4b8c1b199559,VERS,8,Lepus semianimus mortis in solacio:,0160a853-3994-46a8-9dc2-ef3436dbb8c3,63cda0c5-ccbd-4c9f-985a-2eeaad27064d,865,870
faadfd23-8b46-4540-8802-4b8c1b199559,VERS,9,"Qui modo securus nostra irridebas mala,",1a63638e-8407-4a17-9063-8fabdbeec333,63cda0c5-ccbd-4c9f-985a-2eeaad27064d,871,877
faadfd23-8b46-4540-8802-4b8c1b199559,VERS,10,Simili querela fata deploras tua.,d4abaf70-3fe1-43ca-b8e6-a76001bfe66c,63cda0c5-ccbd-4c9f-985a-2eeaad27064d,878,883
faadfd23-8b46-4540-8802-4b8c1b199559,POEM,10,Lupus et vulpes iudice simio.,0440fc27-f3fc-4b3f-a989-d100353d931d,7c5c98ef-9553-46a7-ac32-c67d72c4b3a1,884,954
faadfd23-8b46-4540-8802-4b8c1b199559,TITL,1,Lupus et vulpes iudice simio.,a90b4353-3699-4a74-8ad6-a7814ef93320,0440fc27-f3fc-4b3f-a989-d100353d931d,884,889
faadfd23-8b46-4540-8802-4b8c1b199559,VERS,1,"Quicumque turpi fraude semel innotuit,",d33e5496-672f-4ac9-b145-0bc0867b2622,0440fc27-f3fc-4b3f-a989-d100353d931d,890,895
faadfd23-8b46-4540-8802-4b8c1b199559,VERS,2,"Etiam si verum dicit, amittit fidem.",8315ae67-b943-489d-923b-5168269a346a,0440fc27-f3fc-4b3f-a989-d100353d931d,896,903
faadfd23-8b46-4540-8802-4b8c1b199559,VERS,3,Hoc attestatur brevis Aesopi fabula.,3c2726af-ba65-4599-b75a-630d5e0384ed,0440fc27-f3fc-4b3f-a989-d100353d931d,904,909
faadfd23-8b46-4540-8802-4b8c1b199559,VERS,4,Lupus arguebat vulpem furti crimine;,6aaa7fba-dadf-4187-9904-2d311be8ae30,0440fc27-f3fc-4b3f-a989-d100353d931d,910,915
faadfd23-8b46-4540-8802-4b8c1b199559,VERS,5,Negabat illa se esse culpae proximam.,2c8e25a2-f587-4bed-82e4-d8db03306085,0440fc27-f3fc-4b3f-a989-d100353d931d,916,922
faadfd23-8b46-4540-8802-4b8c1b199559,VERS,6,Tunc iudex inter illos sedit simius.,3957c77a-97c5-4597-8bc2-4f1b47351f98,0440fc27-f3fc-4b3f-a989-d100353d931d,923,929
faadfd23-8b46-4540-8802-4b8c1b199559,VERS,7,"Uterque causam cum perorassent suam,",a23ec68c-6f87-470e-a28b-21b4abcc2051,0440fc27-f3fc-4b3f-a989-d100353d931d,930,935
faadfd23-8b46-4540-8802-4b8c1b199559,VERS,8,Dixisse fertur simius sententiam:,aada85a5-6b7c-48f4-bcf2-c02ae314d3b4,0440fc27-f3fc-4b3f-a989-d100353d931d,936,940
faadfd23-8b46-4540-8802-4b8c1b199559,VERS,9,Tu non videris perdidisse quod petis;,4b3427de-8fea-4aa7-bdf6-1bbdc9d9d83b,0440fc27-f3fc-4b3f-a989-d100353d931d,941,947
faadfd23-8b46-4540-8802-4b8c1b199559,VERS,10,Te credo surripuisse quod pulchre negas.,6c7b3468-614e-472e-8a9a-6add0b16d8dd,0440fc27-f3fc-4b3f-a989-d100353d931d,948,954
faadfd23-8b46-4540-8802-4b8c1b199559,POEM,11,Asinus et leo venantes.,379ddbb9-97b4-4a6c-b45b-3d591858fcfe,7c5c98ef-9553-46a7-ac32-c67d72c4b3a1,955,1059
faadfd23-8b46-4540-8802-4b8c1b199559,TITL,1,Asinus et leo venantes.,db5ed415-b599-4fe4-9b8e-3ac8d146371f,379ddbb9-97b4-4a6c-b45b-3d591858fcfe,955,959
faadfd23-8b46-4540-8802-4b8c1b199559,VERS,1,"Virtutis expers, verbis iactans gloriam,",8764d878-88ca-4118-8d64-ba6b64ac9281,379ddbb9-97b4-4a6c-b45b-3d591858fcfe,960,966
