workId,typ,cnt,name,node,parent,fromIndex,toIndex
faadfd23-8b46-4540-8802-4b8c1b199559,VERS,2,"Cui reddidi iam pridem quicquid debui,",699dc594-79a4-44c6-aebb-85d649b16a51,54dee0d6-df97-4794-a7e1-4e6444df2961,9730,9736
faadfd23-8b46-4540-8802-4b8c1b199559,VERS,3,Auctoritatis esse scito gratia:,38dae7bb-6bd4-427f-a29a-0ae08d3c7261,54dee0d6-df97-4794-a7e1-4e6444df2961,9737,9741
faadfd23-8b46-4540-8802-4b8c1b199559,VERS,4,"Ut quidam artifices nostro faciunt saeculo,",9d38ccd1-3311-4ff6-be87-605299b18b3e,54dee0d6-df97-4794-a7e1-4e6444df2961,9742,9748
faadfd23-8b46-4540-8802-4b8c1b199559,VERS,5,"Qui pretium operibus maius inveniunt novis,",7f93f297-39a5-40c9-82b6-5cbdf415d9ad,54dee0d6-df97-4794-a7e1-4e6444df2961,9749,9755
faadfd23-8b46-4540-8802-4b8c1b199559,VERS,6,"Si marmori ascripserunt Praxitelen suo,",e673bd2e-13f8-42ba-b51a-1207a5b8134d,54dee0d6-df97-4794-a7e1-4e6444df2961,9756,9761
faadfd23-8b46-4540-8802-4b8c1b199559,VERS,7,"Trito Myronem argento, tabulae Zeuxidem.",99d3093a-1746-400b-a049-2c392a1b7200,54dee0d6-df97-4794-a7e1-4e6444df2961,9762,9768
faadfd23-8b46-4540-8802-4b8c1b199559,VERS,8,Adeo fucatae plus vetustati favet,f4e89083-eca1-48db-acfc-ae7eb1330761,54dee0d6-df97-4794-a7e1-4e6444df2961,9769,9773
faadfd23-8b46-4540-8802-4b8c1b199559,VERS,9,Invidia mordax quam bonis praesentibus.,1cddc5f4-aefd-4535-af75-1b07b2ee5575,54dee0d6-df97-4794-a7e1-4e6444df2961,9774,9779
faadfd23-8b46-4540-8802-4b8c1b199559,VERS,10,Sed iam ad fabellam talis exempli feror.,28a8d7ad-f20c-4598-a089-745e9e04b81c,54dee0d6-df97-4794-a7e1-4e6444df2961,9780,9787
faadfd23-8b46-4540-8802-4b8c1b199559,POEM,1,Demetrius rex et Menander poeta: Quomodo saepe fallatur hominum iudicium.,642f6e62-cd96-4b04-b8d4-40c83eca8e07,0133a4b7-9d04-4b47-a27a-e665d515019d,9788,9922
faadfd23-8b46-4540-8802-4b8c1b199559,TITL,1,Demetrius rex et Menander poeta: Quomodo saepe fallatur hominum iudicium.,da9361ec-0553-4c9b-8904-2e1b81c13b25,642f6e62-cd96-4b04-b8d4-40c83eca8e07,9788,9799
faadfd23-8b46-4540-8802-4b8c1b199559,VERS,1,"Demetrius qui dictus est Phalereus,",11f1d329-ab4a-4190-86eb-06b6cc4b9d25,642f6e62-cd96-4b04-b8d4-40c83eca8e07,9800,9805
faadfd23-8b46-4540-8802-4b8c1b199559,VERS,2,Athenas occupavit imperio improbo.,2f3f5308-5b11-4b96-af66-eb733544bfb5,642f6e62-cd96-4b04-b8d4-40c83eca8e07,9806,9810
faadfd23-8b46-4540-8802-4b8c1b199559,VERS,3,"Ut mos est vulgi, passim et certatim ruit,",64a06525-f3ab-4703-8b14-e061bee69656,642f6e62-cd96-4b04-b8d4-40c83eca8e07,9811,9820
faadfd23-8b46-4540-8802-4b8c1b199559,VERS,4,"""Feliciter!"" succlamans. Ipsi principes",621c327e-999d-4244-bc9e-ecbfc2c5045e,642f6e62-cd96-4b04-b8d4-40c83eca8e07,9821,9828
faadfd23-8b46-4540-8802-4b8c1b199559,VERS,5,"Illam osculantur, qua sunt oppressi, manum,",2c54efd6-5313-4fc6-acd3-549213da72e9,642f6e62-cd96-4b04-b8d4-40c83eca8e07,9829,9837
faadfd23-8b46-4540-8802-4b8c1b199559,VERS,6,Tacite gementes tristem fortunae vicem.,447f3d58-c966-4ccd-a8e3-88aad5ca3a89,642f6e62-cd96-4b04-b8d4-40c83eca8e07,9838,9843
faadfd23-8b46-4540-8802-4b8c1b199559,VERS,7,"Quin etiam resides et sequentes otium,",41c37b18-ced2-4482-9d7e-07fc6aa12b2b,642f6e62-cd96-4b04-b8d4-40c83eca8e07,9844,9850
faadfd23-8b46-4540-8802-4b8c1b199559,VERS,8,"Ni defuisse noceat, repunt ultimi;",9ecde4b9-4aea-4627-9809-fcdc33e35760,642f6e62-cd96-4b04-b8d4-40c83eca8e07,9851,9857
faadfd23-8b46-4540-8802-4b8c1b199559,VERS,9,"In quis Menander, nobilis comoediis",61b3829d-d3fd-4790-b632-7dc4916a5993,642f6e62-cd96-4b04-b8d4-40c83eca8e07,9858,9863
faadfd23-8b46-4540-8802-4b8c1b199559,VERS,10,"Quas, ipsum ignorans, legerat Demetrius",0cc69459-9016-4bae-a2be-b8c39dcf360e,642f6e62-cd96-4b04-b8d4-40c83eca8e07,9864,9870
faadfd23-8b46-4540-8802-4b8c1b199559,VERS,11,"Et admiratus fuerat ingenium viri,",87247964-58ee-4c2a-a076-1695f268080b,642f6e62-cd96-4b04-b8d4-40c83eca8e07,9871,9876
faadfd23-8b46-4540-8802-4b8c1b199559,VERS,12,"Unguento delibutus, vestitu fluens,",7bf6d3af-afe5-4a49-94eb-85e838e9d8cc,642f6e62-cd96-4b04-b8d4-40c83eca8e07,9877,9882
faadfd23-8b46-4540-8802-4b8c1b199559,VERS,13,Veniebat gressu delicato et languido.,d53d6c06-4e83-4bf1-8315-613f277a7c41,642f6e62-cd96-4b04-b8d4-40c83eca8e07,9883,9888
faadfd23-8b46-4540-8802-4b8c1b199559,VERS,14,Hunc ubi tyrannus vidit extremo agmine:,b5f295d7-6eb6-4aa2-a971-f984c72a4bb7,642f6e62-cd96-4b04-b8d4-40c83eca8e07,9889,9895
faadfd23-8b46-4540-8802-4b8c1b199559,VERS,15,Quisnam cinaedus ille in conspectum meum,e9d560a1-5a76-4521-a461-b5de7e7f09d4,642f6e62-cd96-4b04-b8d4-40c83eca8e07,9896,9901
faadfd23-8b46-4540-8802-4b8c1b199559,VERS,16,Audet venire? Responderunt proximi:,7ae42c97-86da-4b8b-a51a-fa1cf58b700f,642f6e62-cd96-4b04-b8d4-40c83eca8e07,9902,9907
faadfd23-8b46-4540-8802-4b8c1b199559,VERS,17,Hic est Menander scriptor. Mutatus statim:,9e9e62ab-1109-4a75-a9ba-ddda8be3de3e,642f6e62-cd96-4b04-b8d4-40c83eca8e07,9908,9915
faadfd23-8b46-4540-8802-4b8c1b199559,VERS,18,Homo inquit fieri non potest formosior.,358e862c-6eaa-4a21-95f3-f0f7d0fa26b7,642f6e62-cd96-4b04-b8d4-40c83eca8e07,9916,9922
faadfd23-8b46-4540-8802-4b8c1b199559,POEM,2,Viatores et latro.,d7ade5d9-f3f0-4195-a01a-ee8cb3749b7d,0133a4b7-9d04-4b47-a27a-e665d515019d,9923,10029
faadfd23-8b46-4540-8802-4b8c1b199559,TITL,1,Viatores et latro.,c544bdae-784a-437e-baaf-69c4b7860533,d7ade5d9-f3f0-4195-a01a-ee8cb3749b7d,9923,9926
faadfd23-8b46-4540-8802-4b8c1b199559,VERS,1,"Duo cum incidissent in latronem milites,",cd24bd14-bbc1-4e75-93f7-f5a0df48237f,d7ade5d9-f3f0-4195-a01a-ee8cb3749b7d,9927,9933
faadfd23-8b46-4540-8802-4b8c1b199559,VERS,2,"Unus profugit, alter autem restitit",10aea379-5ef5-485c-ba0a-3e2a8b7c39bb,d7ade5d9-f3f0-4195-a01a-ee8cb3749b7d,9934,9939
faadfd23-8b46-4540-8802-4b8c1b199559,VERS,3,Et vindicavit sese forti dextera.,4b078cda-2bc4-4135-b354-83a1214c9202,d7ade5d9-f3f0-4195-a01a-ee8cb3749b7d,9940,9945
faadfd23-8b46-4540-8802-4b8c1b199559,VERS,4,Latrone exciso timidus accurrit comes,5bc2d40c-d59d-480e-95a5-5e61816e4c83,d7ade5d9-f3f0-4195-a01a-ee8cb3749b7d,9946,9950
faadfd23-8b46-4540-8802-4b8c1b199559,VERS,5,"Stringitque gladium, dein reiecta paenula:",ef55da55-c867-4448-84b8-5797809a2a1f,d7ade5d9-f3f0-4195-a01a-ee8cb3749b7d,9951,9957
faadfd23-8b46-4540-8802-4b8c1b199559,VERS,6,"Cedo inquit illum; iam curabo sentiat,",d6295c69-b6f0-4d0d-b330-3e1abc9de7de,d7ade5d9-f3f0-4195-a01a-ee8cb3749b7d,9958,9965
faadfd23-8b46-4540-8802-4b8c1b199559,VERS,7,"Quos attentarit. Tunc, qui depugnaverat:",a5a1d9fe-1738-4dd3-9125-4a236aad49ca,d7ade5d9-f3f0-4195-a01a-ee8cb3749b7d,9966,9973
faadfd23-8b46-4540-8802-4b8c1b199559,VERS,8,Vellem istis verbis saltem adiuvisses modo;,c2b21bab-7dd6-4ebc-8eda-2271b1a7853b,d7ade5d9-f3f0-4195-a01a-ee8cb3749b7d,9974,9980
faadfd23-8b46-4540-8802-4b8c1b199559,VERS,9,Constantior fuissem vera existimans.,7ee131f5-0ec4-49fe-ad6e-5c6edec942d6,d7ade5d9-f3f0-4195-a01a-ee8cb3749b7d,9981,9985
faadfd23-8b46-4540-8802-4b8c1b199559,VERS,10,Nunc conde ferrum et linguam pariter futtilem.,d4b37362-7bf3-4ce5-bdfe-ed09de34b21f,d7ade5d9-f3f0-4195-a01a-ee8cb3749b7d,9986,9993
faadfd23-8b46-4540-8802-4b8c1b199559,VERS,11,"Ut possis alios ignorantes fallere,",86338d58-9c71-4407-9090-22f0a3ccb447,d7ade5d9-f3f0-4195-a01a-ee8cb3749b7d,9994,9999
faadfd23-8b46-4540-8802-4b8c1b199559,VERS,12,"Ego qui sum expertus quantis fugias viribus,",84d05673-5f12-4610-9f00-ce3e821737de,d7ade5d9-f3f0-4195-a01a-ee8cb3749b7d,10000,10007
faadfd23-8b46-4540-8802-4b8c1b199559,VERS,13,Scio quam virtuti non sit credendum tuae.,0e6c2089-d01b-41b2-a58a-97d5ac24f506,d7ade5d9-f3f0-4195-a01a-ee8cb3749b7d,10008,10015
faadfd23-8b46-4540-8802-4b8c1b199559,VERS,14,Illi assignari debet haec narratio,84e62d75-c38c-4dc2-bf9e-3b2d19a5f951,d7ade5d9-f3f0-4195-a01a-ee8cb3749b7d,10016,10020
faadfd23-8b46-4540-8802-4b8c1b199559,VERS,15,"Qui re secunda fortis est, dubia fugax.",d8497ab7-6ca2-43bc-b500-673b5ff619e0,d7ade5d9-f3f0-4195-a01a-ee8cb3749b7d,10021,10029
faadfd23-8b46-4540-8802-4b8c1b199559,POEM,3,Calvus et musca.,7f8342cb-0a7d-4c9d-8763-f4bcbd22ea9d,0133a4b7-9d04-4b47-a27a-e665d515019d,10030,10126
faadfd23-8b46-4540-8802-4b8c1b199559,TITL,1,Calvus et musca.,c68577cb-0809-4841-9144-2f33347f434a,7f8342cb-0a7d-4c9d-8763-f4bcbd22ea9d,10030,10033
faadfd23-8b46-4540-8802-4b8c1b199559,VERS,1,Calvi momordit musca nudatum caput;,9f48ae00-6dd3-41de-8af8-79704ce0ba7e,7f8342cb-0a7d-4c9d-8763-f4bcbd22ea9d,10034,10039
faadfd23-8b46-4540-8802-4b8c1b199559,VERS,2,Quam opprimere captans alapam sibi duxit gravem.,994260d4-fa01-47a6-b178-b39a125e51c1,7f8342cb-0a7d-4c9d-8763-f4bcbd22ea9d,10040,10047
faadfd23-8b46-4540-8802-4b8c1b199559,VERS,3,Tunc illa irridens: Punctum volucris parvulae,c04c1f1a-e808-44ef-992d-d08badc5b829,7f8342cb-0a7d-4c9d-8763-f4bcbd22ea9d,10048,10054
faadfd23-8b46-4540-8802-4b8c1b199559,VERS,4,"Voluisti morte ulcisci; quid facies tibi,",33219b52-706f-4466-898b-15a6d00e0929,7f8342cb-0a7d-4c9d-8763-f4bcbd22ea9d,10055,10062
faadfd23-8b46-4540-8802-4b8c1b199559,VERS,5,Iniuriae qui addideris contumeliam?,45152cf8-5830-4c6b-82fc-0c250c2c3e9a,7f8342cb-0a7d-4c9d-8763-f4bcbd22ea9d,10063,10067
faadfd23-8b46-4540-8802-4b8c1b199559,VERS,6,"Respondit: Mecum facile redeo in gratiam,",b06798f9-c4e1-4b73-b728-1e268a656c05,7f8342cb-0a7d-4c9d-8763-f4bcbd22ea9d,10068,10075
faadfd23-8b46-4540-8802-4b8c1b199559,VERS,7,Quia non fuisse mentem laedendi scio.,3653daed-0b2d-4bd8-a92c-f89569814ad9,7f8342cb-0a7d-4c9d-8763-f4bcbd22ea9d,10076,10082
faadfd23-8b46-4540-8802-4b8c1b199559,VERS,8,"Sed te, contempti generis animal improbum,",86741a16-7158-4b45-bb32-47965039b4d1,7f8342cb-0a7d-4c9d-8763-f4bcbd22ea9d,10083,10090
faadfd23-8b46-4540-8802-4b8c1b199559,VERS,9,"Quae delectaris bibere humanum sanguinem,",3e9347db-47ae-4ee8-b766-c6ed0230b7d3,7f8342cb-0a7d-4c9d-8763-f4bcbd22ea9d,10091,10096
faadfd23-8b46-4540-8802-4b8c1b199559,VERS,10,Optem necare vel maiore incommodo.,6d9dfb1d-727d-4adc-a958-b1ba6700b54e,7f8342cb-0a7d-4c9d-8763-f4bcbd22ea9d,10097,10102
faadfd23-8b46-4540-8802-4b8c1b199559,VERS,11,†Hoc argumentum veniam ei dari docet,44907d27-a175-4935-9d3c-4d4642facfcf,7f8342cb-0a7d-4c9d-8763-f4bcbd22ea9d,10103,10109
faadfd23-8b46-4540-8802-4b8c1b199559,VERS,12,"Qui casu peccat. Nam qui consilio est nocens,",9ffabbeb-7f2b-4754-8305-85c242694193,7f8342cb-0a7d-4c9d-8763-f4bcbd22ea9d,10110,10119
faadfd23-8b46-4540-8802-4b8c1b199559,VERS,13,Illum esse quamvis dignum poena iudico.,4685fd0f-c3a6-4095-9dae-e3c3b86555fa,7f8342cb-0a7d-4c9d-8763-f4bcbd22ea9d,10120,10126
faadfd23-8b46-4540-8802-4b8c1b199559,POEM,4,Asinus et porcellus.,046bc20f-9fe7-4cf4-9781-90c77549438e,0133a4b7-9d04-4b47-a27a-e665d515019d,10127,10210
faadfd23-8b46-4540-8802-4b8c1b199559,TITL,1,Asinus et porcellus.,39f9f1e6-c472-4142-9745-bada9adf446a,046bc20f-9fe7-4cf4-9781-90c77549438e,10127,10130
faadfd23-8b46-4540-8802-4b8c1b199559,VERS,1,"Quidam immolasset verrem cum sancto Herculi,",a21b24f7-6503-41a6-8dac-ba6f4deb660f,046bc20f-9fe7-4cf4-9781-90c77549438e,10131,10137
faadfd23-8b46-4540-8802-4b8c1b199559,VERS,2,"Cui pro salute votum debebat sua,",cf01ec6f-9ad9-45b2-9f5e-717be8c5f1e3,046bc20f-9fe7-4cf4-9781-90c77549438e,10138,10144
faadfd23-8b46-4540-8802-4b8c1b199559,VERS,3,Asello iussit reliquias poni hordei.,591719c8-a447-4fd4-9d14-534b58cde440,046bc20f-9fe7-4cf4-9781-90c77549438e,10145,10150
faadfd23-8b46-4540-8802-4b8c1b199559,VERS,4,Quas aspernatus ille sic locutus est:,d9ba6190-dbb5-4cb9-96f9-7cf5827f64d8,046bc20f-9fe7-4cf4-9781-90c77549438e,10151,10157
faadfd23-8b46-4540-8802-4b8c1b199559,VERS,5,"Libenter istum prorsus appeterem cibum,",ce84d58a-a311-43f5-99af-dfcc2583b634,046bc20f-9fe7-4cf4-9781-90c77549438e,10158,10163
faadfd23-8b46-4540-8802-4b8c1b199559,VERS,6,"Nisi, qui nutritus illo est, iugulatus foret.",673914f8-1140-4015-b44f-60198701721c,046bc20f-9fe7-4cf4-9781-90c77549438e,10164,10173
faadfd23-8b46-4540-8802-4b8c1b199559,VERS,7,Huius respectu fabulae deterritus,9916bc18-8350-4931-b13b-9151296721a8,046bc20f-9fe7-4cf4-9781-90c77549438e,10174,10177
faadfd23-8b46-4540-8802-4b8c1b199559,VERS,8,Periculosum semper vitavi lucrum.,82a716f5-856d-44b2-8d47-2a7f7c358f42,046bc20f-9fe7-4cf4-9781-90c77549438e,10178,10182
faadfd23-8b46-4540-8802-4b8c1b199559,VERS,9,"Sed dicis: Qui rapuere divitias, habent.",5c58e7bc-4b87-4b02-ae9e-e75d8df5c06f,046bc20f-9fe7-4cf4-9781-90c77549438e,10183,10191
faadfd23-8b46-4540-8802-4b8c1b199559,VERS,10,Numeremus agedum qui deprensi perierunt:,7867cfa5-8047-4873-92ce-57e536a92f9a,046bc20f-9fe7-4cf4-9781-90c77549438e,10192,10197
faadfd23-8b46-4540-8802-4b8c1b199559,VERS,11,Maiorem turbam punitorum reperies.,c6fc4fba-36ed-4fb5-9492-70b7736d507d,046bc20f-9fe7-4cf4-9781-90c77549438e,10198,10202
faadfd23-8b46-4540-8802-4b8c1b199559,VERS,12,"Paucis temeritas est bono, multis malo.",a393ba5e-8d9b-4199-b215-7a5b7819af61,046bc20f-9fe7-4cf4-9781-90c77549438e,10203,10210
faadfd23-8b46-4540-8802-4b8c1b199559,POEM,5,Scurra et rusticus.,663c52b6-5f6f-4c3f-980a-09e65542a30b,0133a4b7-9d04-4b47-a27a-e665d515019d,10211,10461
faadfd23-8b46-4540-8802-4b8c1b199559,TITL,1,Scurra et rusticus.,401e4e5d-431c-4607-98a8-792c442194cb,663c52b6-5f6f-4c3f-980a-09e65542a30b,10211,10214
faadfd23-8b46-4540-8802-4b8c1b199559,VERS,1,Pravo favore labi mortales solent,54621fad-047b-47de-9408-cade8f29b795,663c52b6-5f6f-4c3f-980a-09e65542a30b,10215,10219
faadfd23-8b46-4540-8802-4b8c1b199559,VERS,2,"Et, pro iudicio dum stant erroris sui,",75883c0e-6625-4da5-ad94-0e6ec6d9e1de,663c52b6-5f6f-4c3f-980a-09e65542a30b,10220,10228
faadfd23-8b46-4540-8802-4b8c1b199559,VERS,3,Ad paenitendum rebus manifestis agi.,6f7efae4-1968-44d3-9aa7-2ff4143faf5b,663c52b6-5f6f-4c3f-980a-09e65542a30b,10229,10234
faadfd23-8b46-4540-8802-4b8c1b199559,VERS,4,Facturus ludos dives quidam nobilis,2f19ffb5-f389-4973-ad47-1057ac1e7678,663c52b6-5f6f-4c3f-980a-09e65542a30b,10235,10239
faadfd23-8b46-4540-8802-4b8c1b199559,VERS,5,Proposito cunctos invitavit praemio,1d626197-69ae-44cf-ab52-cc0531f3ee59,663c52b6-5f6f-4c3f-980a-09e65542a30b,10240,10243
faadfd23-8b46-4540-8802-4b8c1b199559,VERS,6,Quam quisque posset ut novitatem ostenderet.,bb42f6d1-30ce-43ad-a4fc-f15818ff3c70,663c52b6-5f6f-4c3f-980a-09e65542a30b,10244,10250
faadfd23-8b46-4540-8802-4b8c1b199559,VERS,7,Venere artifices laudis ad certamina;,2b20ed41-57cc-4b14-b491-2930a801bbf9,663c52b6-5f6f-4c3f-980a-09e65542a30b,10251,10256
faadfd23-8b46-4540-8802-4b8c1b199559,VERS,8,"Quos inter scurra, notus urbano sale,",b453a940-9d1e-4527-bb9e-f5731d475969,663c52b6-5f6f-4c3f-980a-09e65542a30b,10257,10264
faadfd23-8b46-4540-8802-4b8c1b199559,VERS,9,Habere dixit se genus spectaculi,e62fc087-6c29-4c7a-8442-8c5b4b2454f3,663c52b6-5f6f-4c3f-980a-09e65542a30b,10265,10269
faadfd23-8b46-4540-8802-4b8c1b199559,VERS,10,Quod in theatro numquam prolatum foret.,dd6c1fb3-d4f3-4378-bf0e-2c6f6e377ed6,663c52b6-5f6f-4c3f-980a-09e65542a30b,10270,10276
faadfd23-8b46-4540-8802-4b8c1b199559,VERS,11,Dispersus rumor civitatem concitat.,904cfa86-5e24-4b10-91d9-417f354319b8,663c52b6-5f6f-4c3f-980a-09e65542a30b,10277,10281
faadfd23-8b46-4540-8802-4b8c1b199559,VERS,12,Paulo ante vacua turbam deficiunt loca.,cbc35adb-2106-460a-8eb9-125d1d178dcd,663c52b6-5f6f-4c3f-980a-09e65542a30b,10282,10288
faadfd23-8b46-4540-8802-4b8c1b199559,VERS,13,In scaena vero postquam solus constitit,17b9a551-8959-4b08-b3ba-ffd98a8f232b,663c52b6-5f6f-4c3f-980a-09e65542a30b,10289,10294
faadfd23-8b46-4540-8802-4b8c1b199559,VERS,14,"Sine apparatu, nullis adiutoribus,",bccff87a-7a82-45d2-84f4-bb67f2dcdecb,663c52b6-5f6f-4c3f-980a-09e65542a30b,10295,10300
faadfd23-8b46-4540-8802-4b8c1b199559,VERS,15,Silentium ipsa fecit exspectatio.,314bb7b2-9652-4028-8166-3aea9dcfb201,663c52b6-5f6f-4c3f-980a-09e65542a30b,10301,10305
faadfd23-8b46-4540-8802-4b8c1b199559,VERS,16,Ille in sinum repente demisit caput,33c47606-1e4c-4836-857d-8ae1db29ef1b,663c52b6-5f6f-4c3f-980a-09e65542a30b,10306,10311
faadfd23-8b46-4540-8802-4b8c1b199559,VERS,17,"Et sic porcelli vocem est imitatus sua,",fd3bced7-2d46-441d-92d7-814f3a5e09f1,663c52b6-5f6f-4c3f-980a-09e65542a30b,10312,10319
faadfd23-8b46-4540-8802-4b8c1b199559,VERS,18,Verum ut subesse pallio contenderent,956ca49e-03f3-4bd3-8a72-e6da91abb3ed,663c52b6-5f6f-4c3f-980a-09e65542a30b,10320,10324
faadfd23-8b46-4540-8802-4b8c1b199559,VERS,19,Et excuti iuberent. Quo facto simul,f5fb0677-6fc8-47c9-8ac5-9ee1c0598841,663c52b6-5f6f-4c3f-980a-09e65542a30b,10325,10331
faadfd23-8b46-4540-8802-4b8c1b199559,VERS,20,"Nihil est repertum, multis onerant lancibus",2fab3b3c-fd6c-4cdf-bad5-7bcacb084abd,663c52b6-5f6f-4c3f-980a-09e65542a30b,10332,10338
faadfd23-8b46-4540-8802-4b8c1b199559,VERS,21,Hominemque plausu prosequuntur maximo.,3d74475b-40b5-426a-80c5-79325a3352c2,663c52b6-5f6f-4c3f-980a-09e65542a30b,10339,10343
faadfd23-8b46-4540-8802-4b8c1b199559,VERS,22,Hoc vidit fieri rusticus: Non mehercules,1466d11c-f6a2-4d00-bccd-e57be8ba952e,663c52b6-5f6f-4c3f-980a-09e65542a30b,10344,10350
faadfd23-8b46-4540-8802-4b8c1b199559,VERS,23,"Me vincet inquit, et statim professus est",19cd4757-ee26-45d6-8b34-86f02530500a,663c52b6-5f6f-4c3f-980a-09e65542a30b,10351,10358
faadfd23-8b46-4540-8802-4b8c1b199559,VERS,24,Idem facturum melius se postridie.,2cc4966a-5c65-4eb4-9eb3-94c7aeaddf1a,663c52b6-5f6f-4c3f-980a-09e65542a30b,10359,10364
faadfd23-8b46-4540-8802-4b8c1b199559,VERS,25,Fit turba maior. Iam favor mentes tenet,a1fab94e-8014-4a68-ae0e-e194235e55db,663c52b6-5f6f-4c3f-980a-09e65542a30b,10365,10372
faadfd23-8b46-4540-8802-4b8c1b199559,VERS,26,"Et derisuri, non spectaturi sedent.",3a34f93a-6197-4352-9def-42724bb82a3a,663c52b6-5f6f-4c3f-980a-09e65542a30b,10373,10379
faadfd23-8b46-4540-8802-4b8c1b199559,VERS,27,Uterque prodit. Scurra degrunnit prior,a0fff2fb-ef44-4dcd-98ec-253fc151f176,663c52b6-5f6f-4c3f-980a-09e65542a30b,10380,10385
faadfd23-8b46-4540-8802-4b8c1b199559,VERS,28,Movetque plausus et clamores suscitat.,b0f7494e-dcce-422d-b4df-9e5cedd9ff9d,663c52b6-5f6f-4c3f-980a-09e65542a30b,10386,10391
faadfd23-8b46-4540-8802-4b8c1b199559,VERS,29,Tunc simulans sese vestimentis rusticus,6a5daa37-ca92-4fe9-83ea-5f281a1f1e4b,663c52b6-5f6f-4c3f-980a-09e65542a30b,10392,10396
faadfd23-8b46-4540-8802-4b8c1b199559,VERS,30,"Porcellum obtegere (quod faciebat scilicet,",2c6c82fa-2d3a-4d6f-b3df-d961386e9518,663c52b6-5f6f-4c3f-980a-09e65542a30b,10397,10403
faadfd23-8b46-4540-8802-4b8c1b199559,VERS,31,"Sed, in priore quia nil compererant, latens)",fd3205a5-0e08-4550-bf8a-991a029ae55a,663c52b6-5f6f-4c3f-980a-09e65542a30b,10404,10413
faadfd23-8b46-4540-8802-4b8c1b199559,VERS,32,"Pervellit aurem vero, quem celaverat,",a54cd117-a3e3-45d0-8670-ac661eea769b,663c52b6-5f6f-4c3f-980a-09e65542a30b,10414,10420
faadfd23-8b46-4540-8802-4b8c1b199559,VERS,33,Et cum dolore vocem naturae exprimit.,c39c6243-7074-49db-9ec2-c5c53e60667e,663c52b6-5f6f-4c3f-980a-09e65542a30b,10421,10427
faadfd23-8b46-4540-8802-4b8c1b199559,VERS,34,Acclamat populus scurram multo similius,b54dfc94-2168-446e-96cf-acdc9c40644c,663c52b6-5f6f-4c3f-980a-09e65542a30b,10428,10432
faadfd23-8b46-4540-8802-4b8c1b199559,VERS,35,"Imitatum, et cogit rusticum trudi foras.",67a86809-abe4-4bc8-98c1-c019518f762c,663c52b6-5f6f-4c3f-980a-09e65542a30b,10433,10440
faadfd23-8b46-4540-8802-4b8c1b199559,VERS,36,"At ille profert ipsum porcellum e sinu,",73e59b57-345d-4c1c-8112-ed452ed363f1,663c52b6-5f6f-4c3f-980a-09e65542a30b,10441,10448
faadfd23-8b46-4540-8802-4b8c1b199559,VERS,37,Turpemque aperto pignore errorem probans:,bf58c5f2-b947-4677-bcea-5df7184237e2,663c52b6-5f6f-4c3f-980a-09e65542a30b,10449,10454
faadfd23-8b46-4540-8802-4b8c1b199559,VERS,38,En hic declarat quales sitis iudices!,5cd6f6b2-2c61-4f59-af1f-a8220f088e8f,663c52b6-5f6f-4c3f-980a-09e65542a30b,10455,10461
faadfd23-8b46-4540-8802-4b8c1b199559,POEM,6,Calvus et quidam aeque pilis defectus.,5f054591-25b3-493a-8ffb-4d1e67bd4b9b,0133a4b7-9d04-4b47-a27a-e665d515019d,10462,10521
faadfd23-8b46-4540-8802-4b8c1b199559,TITL,1,Calvus et quidam aeque pilis defectus.,c14536fd-0d65-40d2-b3e8-0027c7cad3ad,5f054591-25b3-493a-8ffb-4d1e67bd4b9b,10462,10468
faadfd23-8b46-4540-8802-4b8c1b199559,VERS,1,Invenit calvus forte in trivio pectinem.,7bc11e46-5c95-4d8f-9414-67d73ce433a6,5f054591-25b3-493a-8ffb-4d1e67bd4b9b,10469,10475
faadfd23-8b46-4540-8802-4b8c1b199559,VERS,2,Accessit alter aeque defectus pilis.,5d4f0ea4-e646-426e-a38e-9411ec827248,5f054591-25b3-493a-8ffb-4d1e67bd4b9b,10476,10481
faadfd23-8b46-4540-8802-4b8c1b199559,VERS,3,Heia! inquit in commune quodcumque est lucri!,c312c3b8-97b4-42eb-ad3c-41db0a334be5,5f054591-25b3-493a-8ffb-4d1e67bd4b9b,10482,10490
faadfd23-8b46-4540-8802-4b8c1b199559,VERS,4,Ostendit ille praedam et adiecit simul:,84fa1375-2594-4cf8-838b-bfe8c97a93fe,5f054591-25b3-493a-8ffb-4d1e67bd4b9b,10491,10497
faadfd23-8b46-4540-8802-4b8c1b199559,VERS,5,Superum voluntas favit; sed fato invido,93f55a41-bbbf-4810-9042-b14d4082322b,5f054591-25b3-493a-8ffb-4d1e67bd4b9b,10498,10504
faadfd23-8b46-4540-8802-4b8c1b199559,VERS,6,"Carbonem, ut aiunt, pro thesauro invenimus.",5cdef5f2-faa0-4e6d-871c-d769b4c4e11e,5f054591-25b3-493a-8ffb-4d1e67bd4b9b,10505,10513
faadfd23-8b46-4540-8802-4b8c1b199559,VERS,7,"Quem spes delusit, huic querela convenit.",29a6c7b6-8c53-4fa3-a847-e4b5b2c93e91,5f054591-25b3-493a-8ffb-4d1e67bd4b9b,10514,10521
faadfd23-8b46-4540-8802-4b8c1b199559,POEM,7,Princeps tibicen.,9c86ce91-2e58-412b-b9e5-f06c3e93cb05,0133a4b7-9d04-4b47-a27a-e665d515019d,10522,10781
faadfd23-8b46-4540-8802-4b8c1b199559,TITL,1,Princeps tibicen.,e5f7e03a-8b82-4ff1-ab47-18eddc2131f9,9c86ce91-2e58-412b-b9e5-f06c3e93cb05,10522,10524
faadfd23-8b46-4540-8802-4b8c1b199559,VERS,1,Ubi vanus animus aura captus frivola,137dd745-0b40-4169-8f5f-d107ca83a1ec,9c86ce91-2e58-412b-b9e5-f06c3e93cb05,10525,10530
faadfd23-8b46-4540-8802-4b8c1b199559,VERS,2,"Arripuit insolentem sibi fiduciam,",3fd598fc-5384-4943-b90d-917a0c7f4094,9c86ce91-2e58-412b-b9e5-f06c3e93cb05,10531,10535
faadfd23-8b46-4540-8802-4b8c1b199559,VERS,3,Facile ad derisum stulta levitas ducitur.,b1b5713d-8bab-42f9-82b9-6c7382065046,9c86ce91-2e58-412b-b9e5-f06c3e93cb05,10536,10542
faadfd23-8b46-4540-8802-4b8c1b199559,VERS,4,"Princeps tibicen notior paulo fuit,",736c4dae-2a8b-4115-b516-668efd5ff56b,9c86ce91-2e58-412b-b9e5-f06c3e93cb05,10543,10548
faadfd23-8b46-4540-8802-4b8c1b199559,VERS,5,Operam Bathyllo solitus in scaena dare.,6b31c75f-b7e3-473a-88da-a3f1d40f9fca,9c86ce91-2e58-412b-b9e5-f06c3e93cb05,10549,10555
faadfd23-8b46-4540-8802-4b8c1b199559,VERS,6,Is forte ludis (non satis memini quibus),624d5393-b1e6-47a3-9212-c94472a8a86b,9c86ce91-2e58-412b-b9e5-f06c3e93cb05,10556,10564
faadfd23-8b46-4540-8802-4b8c1b199559,VERS,7,"Dum pegma rapitur, concidit casu gravi",c88290e3-c322-423d-a467-4bd917adaf5f,9c86ce91-2e58-412b-b9e5-f06c3e93cb05,10565,10571
faadfd23-8b46-4540-8802-4b8c1b199559,VERS,8,"Nec opinans, et sinistram fregit tibiam,",e7156e93-e14b-464f-8232-bd5be8babfec,9c86ce91-2e58-412b-b9e5-f06c3e93cb05,10572,10579
faadfd23-8b46-4540-8802-4b8c1b199559,VERS,9,Duas cum dextras maluisset perdere.,adb0bbb5-3dbd-4f97-9bd2-df29d8fc3a10,9c86ce91-2e58-412b-b9e5-f06c3e93cb05,10580,10585
faadfd23-8b46-4540-8802-4b8c1b199559,VERS,10,Inter manus sublatus et multum gemens,906f112d-dcab-4a66-8586-3af138d16ec2,9c86ce91-2e58-412b-b9e5-f06c3e93cb05,10586,10591
faadfd23-8b46-4540-8802-4b8c1b199559,VERS,11,"Domum refertur. Aliquot menses transeunt,",55bacd57-6030-43e1-ba74-418dcb0e1f5e,9c86ce91-2e58-412b-b9e5-f06c3e93cb05,10592,10598
faadfd23-8b46-4540-8802-4b8c1b199559,VERS,12,Ad sanitatem dum venit curatio.,c69f8129-e59f-4171-a133-13f35fde42cc,9c86ce91-2e58-412b-b9e5-f06c3e93cb05,10599,10604
faadfd23-8b46-4540-8802-4b8c1b199559,VERS,13,"Ut spectatorum mos est et lepidum genus,",f28c5dcd-b0a0-4a64-88d4-a4c84569e8a2,9c86ce91-2e58-412b-b9e5-f06c3e93cb05,10605,10612
faadfd23-8b46-4540-8802-4b8c1b199559,VERS,14,"Desiderari coepit, cuius flatibus",31c71eb1-db30-403f-9a13-bd7eab4e0d9d,9c86ce91-2e58-412b-b9e5-f06c3e93cb05,10613,10617
faadfd23-8b46-4540-8802-4b8c1b199559,VERS,15,Solebat excitari saltantis vigor.,d21973db-a6c4-400d-a341-4534e9e310d0,9c86ce91-2e58-412b-b9e5-f06c3e93cb05,10618,10622
faadfd23-8b46-4540-8802-4b8c1b199559,VERS,16,"Erat facturus ludos quidam nobilis,",98804b2d-809e-4764-80f8-59e24bd3e03c,9c86ce91-2e58-412b-b9e5-f06c3e93cb05,10623,10628
faadfd23-8b46-4540-8802-4b8c1b199559,VERS,17,Et incipiebat a se Princeps ingredi:,18d3e0a6-eed4-4264-a12e-9afad08f5e3b,9c86ce91-2e58-412b-b9e5-f06c3e93cb05,10629,10635
faadfd23-8b46-4540-8802-4b8c1b199559,VERS,18,"Reducem tum adducit prece, pretio ut tantummodo",b11d40f9-5c0e-4615-8dde-d3f01bd6d222,9c86ce91-2e58-412b-b9e5-f06c3e93cb05,10636,10643
faadfd23-8b46-4540-8802-4b8c1b199559,VERS,19,Ipso ludorum ostenderet sese die.,3ead3cdf-7174-4803-96fd-a16d8c44e738,9c86ce91-2e58-412b-b9e5-f06c3e93cb05,10644,10649
faadfd23-8b46-4540-8802-4b8c1b199559,VERS,20,"Qui simul advenit, rumor de tibicine",5c88027e-86d0-421e-a760-ca8b76e9f652,9c86ce91-2e58-412b-b9e5-f06c3e93cb05,10650,10656
faadfd23-8b46-4540-8802-4b8c1b199559,VERS,21,"Fremit in theatro. Quidam affirmant mortuum,",206e134e-51e7-488b-97e6-e191dddcf362,9c86ce91-2e58-412b-b9e5-f06c3e93cb05,10657,10664
faadfd23-8b46-4540-8802-4b8c1b199559,VERS,22,Quidam in conspectum proditurum sine mora.,d27391f0-5d88-410c-91a4-978fbe7acf14,9c86ce91-2e58-412b-b9e5-f06c3e93cb05,10665,10671
faadfd23-8b46-4540-8802-4b8c1b199559,VERS,23,"Aulaeo misso, devolutis tonitribus",1a0d44fd-4f42-4b8b-a4b7-6f0eb44378ed,9c86ce91-2e58-412b-b9e5-f06c3e93cb05,10672,10676
faadfd23-8b46-4540-8802-4b8c1b199559,VERS,24,Di sunt locuti more translaticio.,1265d39c-9dc5-46ea-a38a-86577ef8056e,9c86ce91-2e58-412b-b9e5-f06c3e93cb05,10677,10682
faadfd23-8b46-4540-8802-4b8c1b199559,VERS,25,Tunc chorus ignotum modo reducto canticum,6ff2e221-9486-4f22-b8e5-6076e1dc421b,9c86ce91-2e58-412b-b9e5-f06c3e93cb05,10683,10688
faadfd23-8b46-4540-8802-4b8c1b199559,VERS,26,"Insonuit, cuius haec fuit sententia:",758f8d3c-7a70-4812-aea1-c7fa8a133b7c,9c86ce91-2e58-412b-b9e5-f06c3e93cb05,10689,10695
faadfd23-8b46-4540-8802-4b8c1b199559,VERS,27,"Laetare, incolumis Roma, salvo principe!",77af9995-9fb6-4155-bd93-fc6bdea0ac8d,9c86ce91-2e58-412b-b9e5-f06c3e93cb05,10696,10703
